{
  "id": "office-general",
  "name": "비즈니스 오피스 (기획 / 마케팅 / 인사 / 회계)",
  "category": "business",
  "description": "문서 작성, 시장 리서치, 정산 대사, 데이터 취합, 회의록 정리 및 보고 업무를 담당하는 사무 직군",
  "routineQuestions": [
    "매일 또는 매주 다루는 엑셀, 스프레드시트, 문서 템플릿 중 가장 시간이 오래 걸리는 작업은 무엇인가요?",
    "외부 정보(뉴스, 시장 동향, 경쟁사 가격, 트렌드)를 정기적으로 검색하고 정리하는 업무가 있나요?",
    "회의 후 회의록 작성 및 후속 액션 아이템 정리에 얼마나 시간을 쓰시나요?",
    "반복적으로 주고받는 이메일이나 사내 메신저 공지 양식이 있나요?"
  ],
  "commonPainPoints": [
    {
      "task": "두 개 이상의 엑셀/데이터 시트 대조 및 불일치 검증",
      "currentPain": "VLOOKUP이나 눈으로 대조하며 휴먼 에러 발생 위험이 높고 눈이 피로함",
      "axOpportunity": "Python 스크립트 또는 OfficeCLI 도구를 활용하여 두 파일의 불일치 데이터 및 이상치를 3초 만에 검출"
    },
    {
      "task": "경쟁사 동향 및 산업 뉴스 모니터링",
      "currentPain": "매일 아침 포털과 뉴스 사이트를 뒤지며 팀원들에게 공유할 링크를 수동 캡처/요약",
      "axOpportunity": "매일 아침 8시 30분, 지정 키워드 기사를 크롤링하고 3줄 요약하여 슬랙/노션에 자동 브리핑하는 루틴 잡 구성"
    },
    {
      "task": "회의 녹음/노트 기반 액션 아이템 문서화",
      "currentPain": "회의 후 핵심 결정 사항과 담당자별 마감일을 일일이 문서로 다시 정리하는 번거로움",
      "axOpportunity": "메모를 던지면 결정 사항, 미결 질문, 담당자별 To-Do가 표로 구조화된 공식 회의록으로 즉시 변환"
    }
  ],
  "recommendedToolchain": {
    "mcps": ["officecli-mcp", "notion-mcp", "slack-mcp", "playwright-browser-mcp"],
    "skills": ["humanize-korean", "excel-validator", "document-formatter"],
    "routines": ["morning-news-briefing", "post-meeting-summary"]
  }
}
